{
  "$schema": "https://json-schema.org/draft/2020-12/schema",
  "$id": "https://docxodus.dev/schemas/eval/workflow-scenario/v1",
  "title": "Docxodus workflow evaluation scenario v1",
  "description": "One deterministic document-workflow task: a fixture, a machine-readable instruction expressed as agent-surface tool calls, and the invariants that decide whether the run passed. Adding a scenario means writing invariants \u2014 a scenario with no invariant assertions is rejected by the runner rather than silently passing.",
  "type": "object",
  "additionalProperties": false,
  "required": [
    "id",
    "title",
    "fixture",
    "steps",
    "invariants"
  ],
  "properties": {
    "id": {
      "type": "string",
      "pattern": "^[a-z0-9]+(-[a-z0-9]+)*$",
      "description": "Stable identifier. Also the artifact directory name on failure."
    },
    "title": {
      "type": "string",
      "minLength": 1
    },
    "intent": {
      "type": "string",
      "description": "What a human asked for, in one sentence. This is the prompt an agent run would be given; the scripted caller ignores it and executes steps directly, which is what separates engine correctness from model planning quality."
    },
    "fixture": {
      "type": "string",
      "pattern": "^[a-z0-9]+(-[a-z0-9]+)*$",
      "description": "Name of a build script under eval/fixtures. Fixtures are constructed programmatically through the same step format, so the corpus carries no third-party document bytes."
    },
    "trackedChanges": {
      "enum": [
        "accept",
        "render_inline",
        "strip_deletions"
      ],
      "default": "accept",
      "description": "How the session records the scripted caller's own edits \u2014 docxodus_open's trackedChanges."
    },
    "steps": {
      "type": "array",
      "minItems": 1,
      "items": {
        "$ref": "#/$defs/step"
      }
    },
    "invariants": {
      "$ref": "#/$defs/invariants"
    }
  },
  "$defs": {
    "step": {
      "type": "object",
      "additionalProperties": false,
      "required": [
        "tool",
        "args"
      ],
      "properties": {
        "tool": {
          "type": "string",
          "pattern": "^docxodus_[a-z_]+$",
          "description": "An MCP tool name. The scripted caller drives the agent surface, not the .NET API, so the engine baseline is measured where an agent would meet it."
        },
        "target": {
          "$ref": "#/$defs/target",
          "description": "Resolved to an anchor id by docxodus_search before the call, then injected into args. Targeting by content rather than by a chained response keeps a step independent of the previous step's result shape."
        },
        "targets": {
          "type": "object",
          "minProperties": 1,
          "additionalProperties": {
            "$ref": "#/$defs/target"
          },
          "description": "For tools taking several anchors (ranges, moves, bookmarks): each key names the argument that receives its resolved anchor id, each value is a target resolved exactly like `target`. The key already names the argument, so `as` is rejected inside these targets. May be combined with `target` when the argument names do not collide."
        },
        "args": {
          "type": "object",
          "description": "The tool's own arguments, minus sessionId (supplied by the runner) and minus the argument(s) that `target`/`targets` fill in."
        }
      }
    },
    "target": {
      "type": "object",
      "additionalProperties": false,
      "required": [
        "mode",
        "query"
      ],
      "properties": {
        "mode": {
          "enum": [
            "text",
            "regex",
            "kind",
            "bookmark"
          ]
        },
        "query": {
          "type": "string",
          "minLength": 1
        },
        "index": {
          "type": "integer",
          "minimum": 0,
          "default": 0,
          "description": "Which match to use, in document order. The runner fails the scenario when the match count is smaller than index+1, so a fixture drift surfaces as a scenario error rather than as a silently different target."
        },
        "caseSensitive": {
          "type": "boolean",
          "default": true
        },
        "scope": {
          "enum": [
            "body",
            "headers",
            "footers",
            "header_footer",
            "all"
          ],
          "default": "body"
        },
        "as": {
          "type": "string",
          "default": "anchorId",
          "description": "Which argument receives the resolved anchor, e.g. cellAnchorId for table tools."
        }
      }
    },
    "invariants": {
      "type": "object",
      "additionalProperties": false,
      "minProperties": 1,
      "properties": {
        "taskCompletion": {
          "type": "object",
          "additionalProperties": false,
          "description": "Did the intended change land? Asserted over the saved deliverable, not over tool return values.",
          "properties": {
            "textPresent": {
              "type": "array",
              "items": {
                "type": "string"
              }
            },
            "textAbsent": {
              "type": "array",
              "items": {
                "type": "string"
              }
            }
          }
        },
        "targetPrecision": {
          "type": "object",
          "additionalProperties": false,
          "description": "Did it change only what it was asked to? Counted as distinct anchors in the #457 semantic change set from the opening package to the saved state. Must declare at least one bound: an empty targetPrecision bounds nothing.",
          "properties": {
            "changedAnchorsAtLeast": {
              "type": "integer",
              "minimum": 0
            },
            "changedAnchorsAtMost": {
              "type": "integer",
              "minimum": 0
            },
            "changedPartsAtMost": {
              "type": "integer",
              "minimum": 0
            }
          },
          "minProperties": 1
        },
        "collateral": {
          "type": "object",
          "additionalProperties": false,
          "description": "Was unrelated package state preserved? Counted from #456 package manifests of the opening and saved packages.",
          "properties": {
            "partsAdded": {
              "type": "integer",
              "minimum": 0
            },
            "partsRemoved": {
              "type": "integer",
              "minimum": 0
            },
            "textPreserved": {
              "type": "array",
              "items": {
                "type": "string"
              },
              "description": "Content that must survive untouched \u2014 the near-miss occurrences a careless edit would also catch."
            },
            "changedPartsMustBeWithin": {
              "type": "array",
              "minItems": 1,
              "items": {
                "type": "string"
              },
              "description": "Part URIs the #457 change set may touch, exactly as the change set reports them (leading slash: \"/word/document.xml\"). Any changed part outside this allowlist fails the scenario \u2014 the identity assertion that turns 'how many parts changed' into 'the right parts changed'. A misspelled entry fails loudly rather than passing, because the real changed part is then outside the list."
            }
          }
        },
        "trackedRevisions": {
          "type": "object",
          "additionalProperties": false,
          "minProperties": 1,
          "description": "Live tracked-change markup in the delivered session, read through docxodus_track_changes list. This is how a scenario asserts a pre-existing reviewer's revision is still live outside the reversibility path.",
          "properties": {
            "countAtLeast": {
              "type": "integer",
              "minimum": 0
            },
            "countAtMost": {
              "type": "integer",
              "minimum": 0
            },
            "authorsMustInclude": {
              "type": "array",
              "minItems": 1,
              "items": {
                "type": "string"
              }
            }
          }
        },
        "comments": {
          "type": "object",
          "additionalProperties": false,
          "minProperties": 1,
          "description": "Comments in the delivered session, read through docxodus_comment list. Replies are entries carrying parentAnchorId; resolved state is the tool's own resolved flag \u2014 only what the tool reports is assertable.",
          "properties": {
            "countAtLeast": {
              "type": "integer",
              "minimum": 0
            },
            "countAtMost": {
              "type": "integer",
              "minimum": 0
            },
            "authorsMustInclude": {
              "type": "array",
              "minItems": 1,
              "items": {
                "type": "string"
              }
            },
            "repliesAtLeast": {
              "type": "integer",
              "minimum": 0
            },
            "resolvedAtLeast": {
              "type": "integer",
              "minimum": 0
            }
          }
        },
        "validity": {
          "type": "object",
          "additionalProperties": false,
          "description": "Is the deliverable structurally valid? The #463 deliverable gate, run with the opening bytes as baseline.",
          "properties": {
            "decisionIn": {
              "type": "array",
              "items": {
                "enum": [
                  "passed",
                  "passedWithPreExistingFindings",
                  "failed",
                  "notEvaluated"
                ]
              }
            }
          }
        },
        "reversibility": {
          "type": "object",
          "additionalProperties": false,
          "description": "For tracked-change scenarios: does the redline accept to the intended final and reject to the baseline? The #464 proof, with the intended final derived by accepting every revision.",
          "properties": {
            "mode": {
              "enum": [
                "none",
                "acceptAll"
              ],
              "description": "acceptAll derives the intended final by accepting every revision in the deliverable, then proves the deliverable against it and the opening package."
            },
            "mustSucceed": {
              "type": "boolean",
              "default": true,
              "description": "Require full package equivalence on both paths. Opt-in: a session-authored redline is not yet expected to reach it, because the intended final has to be derived and the proof would then be scoring that derivation. See eval/README.md."
            },
            "generatedRevisionsAtLeast": {
              "type": "integer",
              "minimum": 0
            },
            "pathsMustComplete": {
              "type": "boolean",
              "default": true,
              "description": "Both proof paths must run to completion. Defaults on."
            },
            "preExistingMustBePreserved": {
              "type": "boolean",
              "default": true,
              "description": "Resolving only the generated revisions must leave pre-existing review state intact on both paths. Defaults on."
            },
            "rejectMustRestoreBaseline": {
              "type": "boolean",
              "default": true,
              "description": "Rejecting only the generated revisions must be semantically equivalent to the opening package. Unlike the accept path, the baseline is stated up front rather than derived, so this asserts restoration itself. Defaults on."
            }
          },
          "required": [
            "mode"
          ]
        },
        "rendering": {
          "type": "object",
          "additionalProperties": false,
          "description": "Rendering regression, HTML-only in this scaffold. Generated-PDF fidelity is #443's ratchet and is deliberately not a dependency here.",
          "properties": {
            "htmlMustContain": {
              "type": "array",
              "items": {
                "type": "string"
              }
            }
          }
        }
      }
    }
  }
}
